{
  "schema": "gentle-ai.review-integration.status/v1",
  "contract": "gentle-ai.review-integration/v1",
  "operation": "review.status",
  "applicability": "unrelated",
  "receipt": {
    "status": "not_applicable"
  },
  "action": "start",
  "replayability": "not_replayable",
  "target_identity": "sha256:e6faad1cb9ceb2db170e0ec9ea5394b44c3991dff6cbd02fb6787539715968f6",
  "projection": {
    "schema": "gentle-ai.review-integration.projection/v1",
    "kind": "current-changes",
    "projection": "workspace",
    "base_tree": "3e21a205dd9b55021aeae87965092623807e455f",
    "initial_review_tree": "1c3325617279b38743f073302ba190fc421b5a09",
    "current_candidate_tree": "1c3325617279b38743f073302ba190fc421b5a09",
    "paths_digest": "sha256:b93fca961a97d240c2b7023e98772f49ebd2995eda7db07043270b57bed75d71",
    "paths": [
      "tracked.txt"
    ],
    "intended_untracked": [],
    "intended_untracked_proof": "sha256:b97229718d4c7fe50a8892eb474ae5aa6491697bccb400e3e31dbaca4894d2f3",
    "initial_snapshot_identity": "sha256:e6faad1cb9ceb2db170e0ec9ea5394b44c3991dff6cbd02fb6787539715968f6",
    "current_snapshot_identity": "sha256:e6faad1cb9ceb2db170e0ec9ea5394b44c3991dff6cbd02fb6787539715968f6"
  },
  "candidates": []
}
